"","indicator_code","full_description","brief_description_code","in2019s1","in2018s2","in2018s1","included"
"138","TB O-5 (M)","TB treatment coverage: Percentage of new and relapse cases that were notified and treated among the estimated number of incident TB cases in the same year (all forms of TB – bacteriologically confirmed plus clinically diagnosed)","TB tx. coverage - TB O-5(M)",1,1,1,1
"139","TB O-5(M)","TB treatment coverage: Percentage of new and relapse cases that were notified and treated among the estimated number of incident TB cases in the same year (all forms of TB – bacteriologically confirmed plus clinically diagnosed)","TB tx. coverage - TB O-5(M)",1,1,0,1
"140","TB O-6","Notification of RR-TB and/or MDR-TB cases – Percentage of notified cases of bacteriologically confirmed, drug resistant RR-TB and/or MDR-TB as a proportion of all estimated Rifampicin-resistant TB and/or MDR-TB cases","% of all MDR-TB notified - TB O-6",1,1,1,1
"141","TB/HIV I-1","TB/HIV mortality rate per 100,000 population","TB/HIV mortality - TB/HIV I-1",0,1,1,1
"142","TB/HIV-1","Percentage of TB patients who had an HIV test result recorded in the TB register","% TB patients w/ HIV test result recorded in TB register - TB/HIV-1",0,1,1,1
"143","TB/HIV-2","Percentage of registered seropositive patients with tuberculosis who have received antiretroviral treatment during tuberculosis treatment","% of reg. seropositive patients w/ TB who recd. ART during TB tx. - TB/HIV-2",0,1,1,1
"144","TB/HIV-3.1","Percentage of people living with HIV in care (including PMTCT) who are screened for TB in HIV care or treatment settings","% PLHIV in care (inc. PMTCT) screen. for TB in HIV care or tx. settings - TB/HIV-3.1",1,1,1,1
"145","TB/HIV-4","Percentage of new seropositive patients who have started preventive treatment with isoniazid (IPT) during the reporting period","% of new seropos. pat. started on IPT during report per. - TB/HIV-4",0,1,1,1
"146","TB/HIV-4.1","Percentage of people living with HIV newly enrolled in HIV care started on TB preventive therapy","% PLHIV newly enrolled in HIV care started on TB preventive therapy - TB/HIV-4.1",1,1,1,1
"147","TB/HIV-4.2-PCE","Percentage of people living with HIV diagnosed with TB in care and treatment settings","% PLHIV diagnosed w/ TB in care and tx. settings - TB/HIV-4.2-PCE",0,0,0,0
"148","TB/HIV-5","Percentage of registered new and relapse TB patients with documented HIV status","% registered new and relapse TB patients w/ documented HIV status - TB/HIV-5",1,1,1,1
"149","TB/HIV-6","Percentage of HIV-positive new and relapse TB patients on antiretroviral therapy during TB treatment","% HIV-positive new and relapse TB patients on ART dur. TB tx. - TB/HIV-6",0,0,0,0
"150","TB/HIV-6(M)","Percentage of HIV-positive new and relapse TB patients on antiretroviral therapy during TB treatment","% HIV-positive new and relapse TB pat. on ART dur. TB tx. - TB/HIV-6(M)",1,1,1,1
"151","TCP other-1","Percentage of all forms of TB that received adherence support from community workers or volunteers who were successfully treated (completed treatment and cured) in the course of one year. given period","% of TB cas. recd. support from CHW successfully txd.in year - TCP other-1",1,1,1,1
"152","TCP other-2","Number and percentage of CSDT reporting no stock-outs of drugs for the treatment of susceptible TB - TCP other-2","No./% of health ctrs. rep. no stock-outs of DS-TB drugs- TCP other-2",1,1,1,1
"153","TCP-1(M)","Number of notified cases of all forms of TB (i.e. bacteriologically confirmed + clinically diagnosed) Includes new and relapse cases","No. noti. cas.  (all forms) - TCP-1(M)",1,1,1,1
"154","TCP-2(M)","Treatment success rate – all forms: Percentage of TB cases, all forms (bacteriologically confirmed plus clinically diagnosed) successfully treated (cured plus treatment completed) among all TB cases registered for treatment during a specified period, new and relapse cases.","tx. success rate – all forms - TCP-2(M)",1,1,1,1
"155","TCP-3","Percentage of laboratories showing adequate performance in external quality assurance for smear microscopy among the total number of laboratories that undertake smear microscopy during the reporting period","% labs showing adequate performance - TCP-3",1,1,1,1
"156","TCP-4","Percentage of reporting units reporting no stock-outs of anti-TB drugs on the last day of the quarter","% units reporting no stock-outs TB drugs - TCP-4",1,1,1,1
"157","TCP-5","Number of children under 5 in contact with TB patients who began isoniazid preventive therapy","No. child. <5 in contact w/ TB patients who began IPT - TCP-5",1,1,1,1
"158","TCP-6a","Number of TB cases (all forms) notified among prisoners","No. TB cas. notif. among prisoners - TCP-6a",1,1,1,1
"159","TCP-6b","Number of TB cases (all forms) notified among key populations/high-risk groups (other than prisoners)","No. TB cas. notif. among KVPs (not prisoners) - TCP-6b",0,0,0,0
"160","TCP-7a","Number of notified TB cases (all forms) contributed by non-national TB program providers – private/non-governmental facilities","No. noti. TB cas. , private/non-governmental facilities - TCP-7a",0,0,0,0
"161","TCP-7b","Number of notified TB cases (all forms) contributed by non-national TB program providers – public sector","No. noti. TB cas. , public sector - TCP-7b",0,0,0,0
"162","TCP-7c","Number of notified TB cases (all forms) contributed by non-national TB program providers – community referrals","No. noti. TB cas. , community referrals - TCP-7c",1,1,1,1
"163","TCP-8","Percentage of new and relapse TB patients tested using WHO- recommended rapid tests at the time of diagnosis","% new TB patients tested using WHO-recommended rapid tests at the time dx. - TCP-8",0,0,0,0
"164","TCS other- 1","Percentage of ART sites that reported no stock-out of any antiretroviral drugs during the reporting period","% ART sites w/ no stock-out of ARVs dur. report per. - TCS-other 1",1,1,1,1
"165","TCS other-2","Percentage of children living with HIV currently receiving antiretroviral therapy","% of children LHIV currently rec ART - TCS other-2",1,1,1,1
"166","TCS other-3","Number and percentage of health facilities (Screening and Treatment Centers) reporting a stock-out of HIV tests","No./% of health ctrs rep.stock-outs of HIV tests - TCS other-3",1,1,1,1
"167","TCS- other 1","Percentage of ART sites that reported no stock-out of any antiretroviral drugs during the reporting period","% ART sites w/ no stock-out of ARVs dur. report per. - TCS-other 1",0,0,0,0
"168","TCS-1(M)","Percentage of people living with HIV currently receiving antiretroviral therapy","% PLHIV currently receiving ART - TCS-1(M)",1,1,1,1
"169","TCS-10-PCE","Number of individuals counseled","No. individuals counseled - TCS-10-PCE",0,0,0,0
"170","TCS-11-PCE","Percentage of PLHIV from key and vulnerable populations currently receiving ART","% PLHIV from key and vulnerable pop.s currently receiving ART - TCS-11-PCE",0,0,0,0
"171","TCS-2","Percentage of people living with HIV that initiated antiretroviral therapy with a CD4 count of <200 cells/mm3","% PLHIV that initiated ART w/ a CD4 count <200 cells/mm3 - TCS-2",0,0,0,0
"172","TCS-3.1","Percentage of people living with HIV and on antiretroviral therapy who have a suppressed viral load at 12 months (<1000 copies/ml)","% PLHIV and on ART w/ suppressed viral load at 12 mos. (<1000 copies/ml) - TCS-3.1",1,1,1,1
"173","TCS-6","Percentage of ART sites that had a stock-out of any antiretroviral drugs during the reporting period","% ART sites that had a stock-out any ARV drugs dur. the reporting period - TCS-6",1,1,1,1
"174","TCS-7","Percentage of newly diagnosed people linked to HIV care (individual linkage)","% newly diagnosed people linked to HIV care (individual linkage) - TCS-7",0,1,0,1
"175","TCS-8-PCE","Percentage of newly diagnosed PLHIV initiating ART","% newly diagnosed PLHIV initiating ART - TCS-8-PCE",0,0,0,0
"176","TCS-9-PCE","Number of ARV doses administered","No. ARV doses administered - TCS-9-PCE",0,0,0,0
"177","TCS-other 1","Percentage of ART sites that reported no stock-out of any antiretroviral drugs during the reporting period","% ART sites w/ no stock-out of ARVs dur. report per. - TCS-other 1",1,0,0,1
"178","VC-1(M)","Number of long-lasting insecticidal nets distributed to at-risk populations through mass campaigns","No. LLIN distributed to at-risk pop.s through mass campaigns - VC-1(M)",1,1,1,1
"179","VC-3(M)","Number of long-lasting insecticidal nets distributed to targeted risk groups through continuous distribution","No. LLIN distributed to targeted risk groups through continuous distribution - VC-3(M)",1,1,1,1
"180","VC-5","Proportion of households in targeted areas that received indoor residual spraying during the reporting period","Prop. HH in targeted areas recd. IRS dur report period - VC-5",0,0,0,0
"181","VC-6.1","Proportion of population protected by indoor residual spraying within the last 12 months in areas targeted for indoor residual spraying","Prop. pop. protected by IRS w/in the last 12 mos. in areas targeted for IRS - VC-6.1",0,0,0,0
"182","YP-1","Percentage of young people aged 10–24 years reached by life skills–based HIV education in schools","% young people, 10–24 yrs reached by life skills–based HIV education in schools - YP-1",0,0,0,0
"183","YP-2","Percentage of adolescent girls and young women reached with HIV prevention programs- defined package of services","% AGYW reached w/ HIV prevention programs - YP-2",0,1,1,1
"184","YP-3","Number of adolescent girls and young women who were tested for HIV and received their results during the reporting period","No. AGYW tested for HIV and received results dur. the reporting period - YP-3",0,1,1,1
"185","YP-4","Percentage of adolescent girls and young women using pre-exposure prophylaxis","% AGYW using PrEP - YP-4",0,0,0,0
